{
    "$schema": "http://json-schema.org/draft-07/schema#",
    "title": "Generated schema for Root",
    "type": "object",
    "properties": {
      "short_title": {
        "type": "string"
      },
      "title": {
        "type": "string"
      },
      "header_subtext": {
        "type": "string"
      },
      "bookmarklet_link_text": {
        "type": "string"
      },
      "include_instructions": {
        "type": "boolean"
      },
      "custom_instructions": {
        "type": "array",
        "items": {
          "type": "string"
        }
      }
    },
    "required": [
      "short_title",
      "title",
      "bookmarklet_link_text",
      "include_instructions"
    ]
  }